{
  "fetch": {
    "ref": {
      "id": "qs-main",
      "version": "v1",
      "content_hash": "sha256:aaaaaaaaaaaaaaaaaaaaaaaaaaaaaaaaaaaaaaaaaaaaaaaaaaaaaaaaaaaaaaaa"
    },
    "bank": {
      "questions": []
    },
    "approvals": null,
    "change_checked": false,
    "follow_ups": null,
    "affected_question_ids": null
  },
  "spec": {
    "id": "qs-main",
    "version": null,
    "usage": "TRAIN_POOL"
  },
  "reviewed_only": true,
  "regeneration_mode": "full"
}
